{
  "$schema": "https://ui.shadcn.com/schema.json",
  "aliases": {
    "components": "@/components",
    "hooks": "@/hooks",
    "lib": "@/lib",
    "motion": "@/components/motion",
    "ui": "@/components/ui",
    "utils": "@/lib/utils"
  },
  "iconLibrary": "lucide",
  "registries": {
    "@cnippet": "https://ui.cnippet.dev/r/{name}.json"
  },
  "rsc": true,
  "style": "new-york",
  "tailwind": {
    "baseColor": "neutral",
    "config": "",
    "css": "app/globals.css",
    "cssVariables": true,
    "prefix": ""
  },
  "tsx": true
}
